{
  "version": 1,
  "baseline": 50,
  "pointsPerCE": 10,
  "hpPoint": 6,
  "weights": {
    "damage": 1.6,
    "guard": 1.4,
    "heal": 1.3,
    "control": 1.2,
    "quality": 0.5,
    "hpLoss": 1.6,
    "burst": 3,
    "carry": 3
  },
  "assumptions": {
    "turnsPerGeneral": 4,
    "damageEvents": 0.6,
    "damageDealtEvents": 0.65,
    "cardEvents": 1.2,
    "conditional": 0.55,
    "perSkillCap": 2.5,
    "perGeneralCap": 5,
    "uncertainDiscount": 0.65,
    "hpCap": 6
  },
  "rarityThresholds": {
    "U": 52,
    "R": 57,
    "SR": 65,
    "UR": 78
  },
  "overrides": {
    "caocao": {
      "vector": {
        "cards": 0.45
      },
      "confidence": 0.75,
      "notes": "奸雄：0.6次受伤/回合 × 0.75有实体伤害牌 = 0.45牌；护驾在中立单挑无效。"
    },
    "simayi": {
      "vector": {
        "cards": 1.2,
        "quality": 0.25,
        "cost": 0.15
      },
      "confidence": 0.75,
      "notes": "反馈：0.6次受伤 × 偷一张(+2牌差)=1.2；鬼才改判按0.15张成本，牌质收益0.25。"
    },
    "xiahoudun": {
      "vector": {
        "cards": 0.35,
        "damage": 0.22
      },
      "confidence": 0.75,
      "notes": "刚烈：受伤0.6 × 非红桃0.75 × 对手最优选择弃牌或受伤的混合估计；两种结果不同时全计。"
    },
    "zhangliao": {
      "vector": {
        "cards": 0,
        "quality": 0.4,
        "control": 0.15
      },
      "confidence": 0.75,
      "notes": "单挑突袭只有一个目标：偷1张净牌差+2，替代正常摸2张，净增0；额外计拆关键牌价值。"
    },
    "xuzhu": {
      "vector": {
        "damage": 0.5,
        "cost": 0.65,
        "burst": 0.3
      },
      "confidence": 0.75,
      "notes": "裸衣：选择发动率0.65，少摸成本0.65；杀/决斗额外伤害0.5，不能将伤害增幅视为必定命中。"
    },
    "guojia": {
      "vector": {
        "cards": 1.35
      },
      "confidence": 0.75,
      "notes": "遗计0.6次受伤 × 2牌，天妒自然判定约0.15；给自己；未重复扣被动必受伤，主动卖血另算。"
    },
    "zhenji": {
      "vector": {
        "cards": 1,
        "guard": 0.4
      },
      "confidence": 0.75,
      "notes": "洛神黑红等概率且不计改判：几何分布期望摸1；倾国提升防御0.4次/回合，黑牌转化不额外加牌差。"
    },
    "liubei": {
      "vector": {},
      "confidence": 0.75,
      "notes": "单挑仁德只能资敌；可选择不发动。激将在中立单挑无效；身份局需另建模型。"
    },
    "guanyu": {
      "vector": {
        "quality": 0.55,
        "damage": 0.12
      },
      "confidence": 0.75,
      "notes": "武圣转化提高杀的可用性；消耗原红牌，不计算为免费摸牌。"
    },
    "zhangfei": {
      "vector": {
        "damage": 0.32,
        "burst": 0.8,
        "carry": 0.3
      },
      "confidence": 0.75,
      "notes": "咆哮受杀的供给约束；额外命中约0.32/回合；KOF继承手牌提高爆发机会。"
    },
    "zhugeliang": {
      "vector": {
        "quality": 0.8,
        "guard": 0.4
      },
      "confidence": 0.75,
      "notes": "单挑观星只看2张，空城按触发概率折算防御；不套用五人观星收益。"
    },
    "zhaoyun": {
      "vector": {
        "quality": 0.5,
        "guard": 0.2,
        "damage": 0.08
      },
      "confidence": 0.75,
      "notes": "龙胆杀闪互转，按0.5牌质及少量防伤/命中增量估计，牌数不变。"
    },
    "machao": {
      "vector": {
        "damage": 0.28,
        "quality": 0.08
      },
      "confidence": 0.75,
      "notes": "铁骑：杀机会 × 红判概率 × 本可被闪抵消的概率；马术在一对一距离1中不直接加伤害。"
    },
    "huangyueying": {
      "vector": {
        "cards": 1.1,
        "quality": 0.1
      },
      "confidence": 0.75,
      "notes": "集智：平均1.1张普通锦囊/回合，奇才在单挑距离收益很小；依赖牌堆构成。"
    },
    "sunquan": {
      "vector": {
        "quality": 1.8,
        "burst": 0.3
      },
      "confidence": 0.75,
      "notes": "制衡弃摸等量，净牌差0；按筛掉低效牌改善1.8牌质估算；救援中立单挑无效。"
    },
    "ganning": {
      "vector": {
        "control": 0.6,
        "quality": 0.4
      },
      "confidence": 0.75,
      "notes": "奇袭黑牌换拆桥，一换一净牌差0；计定向破坏节奏与牌质，不能将弃对手牌全部算无成本收益。"
    },
    "lvmeng": {
      "vector": {
        "cards": 0.4,
        "burst": 0.35,
        "carry": 0.6
      },
      "confidence": 0.75,
      "notes": "克己保留本应弃置的溢出手牌；扣除放弃杀的机会后折算0.4；KOF囤牌继承另加。"
    },
    "huanggai": {
      "vector": {
        "cards": 1.2,
        "hpLoss": 0.6,
        "burst": 1.1,
        "carry": 0.25
      },
      "confidence": 0.75,
      "notes": "苦肉每回合平均0.6次，摸1.2张且主动失0.6血；卡差与血耗同时列示。"
    },
    "zhouyu": {
      "vector": {
        "cards": 0.35,
        "damage": 0.4875
      },
      "confidence": 0.75,
      "notes": "英姿+1；反间发动0.65：送牌成本0.65，非猜中概率0.75 × 0.65=0.4875伤害。"
    },
    "daqiao": {
      "vector": {
        "control": 0.8,
        "quality": 0.3
      },
      "confidence": 0.75,
      "notes": "国色方片换乐不思蜀，按判定与解乐/无懈折扣；流离不能转移给唯一攻击者，在单挑不计收益。"
    },
    "luxun": {
      "vector": {
        "cards": 0.8,
        "guard": 0.2
      },
      "confidence": 0.75,
      "notes": "连营按每回合0.8次触发；谦逊按顺手/乐命中机会估防御，不是每回合免一伤。"
    },
    "sunshangxiang": {
      "vector": {
        "cards": 0.55,
        "heal": 0.45,
        "cost": 0.45
      },
      "confidence": 0.75,
      "notes": "枭姬约0.275次失装备 ×2；结姻有性别与双方受伤条件，两牌成本折算0.45。"
    },
    "huatuo": {
      "vector": {
        "heal": 0.65,
        "cost": 0.35,
        "quality": 0.45
      },
      "confidence": 0.75,
      "notes": "青囊平均0.35次/回合，耗牌治疗；急救按红牌可用性计牌质，不能将红牌免费创造为桃。"
    },
    "lvbu": {
      "vector": {
        "damage": 0.32,
        "cards": 0.2,
        "burst": 0.45
      },
      "confidence": 0.75,
      "notes": "无双按对手多付闪/杀或额外命中混合估计，不同时给两条分支全部收益。"
    },
    "diaochan": {
      "vector": {
        "cards": 1
      },
      "confidence": 0.75,
      "notes": "离间需两名其他男性，1v1无法发动；闭月每回合稳定+1牌。"
    },
    "huaxiong": {
      "vector": {
        "cards": 0,
        "cost": 0.35
      },
      "confidence": 0.75,
      "notes": "6血体力底盘；耀武资敌按每回合0.35牌等价成本折扣，更多血不代表免费收益。"
    },
    "gongsunzan": {
      "vector": {
        "guard": 0.18
      },
      "confidence": 0.75,
      "notes": "单挑距离压缩，义从只在低血时额外距离防御折算0.18。"
    },
    "xf_yiji": {
      "vector": {
        "cards": 1
      },
      "confidence": 0.75,
      "notes": "机捷可把牌交给自己，每回合+1；急援常规交给其他人，在中立单挑不计资敌收益。"
    },
    "re_yuanshu": {
      "vector": {
        "cards": 0.4
      },
      "confidence": 0.75,
      "notes": "妄尊单挑按对方血量更高概率0.4；无主公额外收益；同疾依赖第三人无效。"
    },
    "std_yuejin": {
      "vector": {
        "damage": 0.35,
        "cost": 0.35,
        "cards": 0.2
      },
      "confidence": 0.75,
      "notes": "骁果基本牌成本与对手弃装备/受伤择优分支折算；不是免费每回合一伤。"
    },
    "old_re_lidian": {
      "vector": {
        "quality": 0.8
      },
      "confidence": 0.75,
      "notes": "恂恂四选二属于牌质而非额外摸2；忘隙双方各摸1，单挑净牌差0。"
    },
    "ganfuren": {
      "vector": {},
      "confidence": 0.75,
      "notes": "淑慎只益其他人；神智弃全手回血仅按紧急择优，不视为稳定正收益。"
    },
    "std_panfeng": {
      "vector": {
        "cards": 0.55,
        "hpLoss": 0.18
      },
      "confidence": 0.75,
      "notes": "狂斧命中/血量条件分支折算，摸牌与失血都计入。"
    },
    "shen_guanyu": {
      "vector": {
        "damage": 0.8,
        "quality": 1,
        "burst": 2.2,
        "carry": 1.2
      },
      "confidence": 0.75,
      "notes": "武神红桃强命无次数，受牌源约束；武魂在单挑/KOF的死亡换将收益按概率计爆发/继承，不作为常驻伤害。"
    },
    "shen_zhaoyun": {
      "vector": {
        "cards": 0.9,
        "guard": 0.9,
        "heal": 0.7,
        "quality": 1.3,
        "burst": 0.8
      },
      "confidence": 0.75,
      "notes": "绝境低血摸牌与龙魂供给合并估计；2血底盘扣12分；双牌转化仍有成本，未额外计双份牌差。"
    },
    "shen_zhugeliang": {
      "vector": {
        "guard": 0.85,
        "quality": 1.3,
        "damage": 0.2,
        "cost": 0.35,
        "burst": 0.6
      },
      "confidence": 0.75,
      "notes": "七星仅交换不产生七张常规手牌；星资源有限，按四回合摊销，雾防御与狂风耗星计成本。"
    },
    "shen_lvmeng": {
      "vector": {
        "cards": 1.05,
        "control": 0.55,
        "quality": 0.7
      },
      "confidence": 0.75,
      "notes": "涉猎五张不同花色期望约3.05张，相对正常摸2净+1.05；攻心看手牌与红桃处理分开折算。"
    },
    "shen_zhouyu": {
      "vector": {
        "damage": 0.4,
        "hpLoss": 0.18,
        "cost": 0.2,
        "burst": 1.5
      },
      "confidence": 0.75,
      "notes": "大业炎3伤需要四色4牌并失3血，单挑不套多人三目标收益；有限爆发按四回合摊销并折发起率。"
    },
    "shen_simayi": {
      "vector": {
        "cards": 1.2,
        "control": 0.6,
        "quality": 0.6,
        "cost": 0.25,
        "burst": 1.2
      },
      "confidence": 0.75,
      "notes": "忍与觉醒有启动时间，白银后极略收益按觉醒概率/四回合折扣；连破单挑终局无额外收益。"
    },
    "shen_caocao": {
      "vector": {
        "cards": 0.9,
        "guard": 0.3,
        "cost": 0.65
      },
      "confidence": 0.75,
      "notes": "单挑归心只偷一名对手(+2牌差/次)，发动0.45；翻面跳回合成本0.65；不套八人归心。"
    },
    "shen_lvbu": {
      "vector": {
        "damage": 0.45,
        "cards": 0.7,
        "cost": 0.8,
        "hpLoss": 0.15,
        "burst": 1.1
      },
      "confidence": 0.75,
      "notes": "神愤标记积累与翻面成本均摊，单挑只有一个目标；无谋负面纳入，不按神字直接UR。"
    },
    "shen_liubei": {
      "vector": {
        "cards": 2.1,
        "damage": 0.65,
        "hpLoss": 0.5,
        "cost": 0.2,
        "quality": 0.6,
        "burst": 1.1,
        "carry": 0.4
      },
      "confidence": 0.75,
      "notes": "龙怒收益扣失血/减上限，杀命中受手牌限制；6血底盘，结营单挑资敌不计正收益。"
    },
    "shen_luxun": {
      "vector": {
        "damage": 0.7,
        "cards": 0.5,
        "control": 0.4,
        "burst": 0.6
      },
      "confidence": 0.75,
      "notes": "摧克奇偶分支择一与启动概率折算，绽火限定摊销；未重复计全部分支。"
    },
    "shen_zhangliao": {
      "vector": {
        "control": 0.8,
        "quality": 0.7,
        "cost": 0.25,
        "burst": 0.5
      },
      "confidence": 0.75,
      "notes": "夺锐需出牌阶段伤害且废装备栏，夺取技能收益高度依赖对手，列为对局敏感估计。"
    },
    "shen_ganning": {
      "vector": {
        "cards": 2.4,
        "control": 0.6,
        "cost": 0.7,
        "quality": 0.4,
        "burst": 1.4,
        "carry": 0.5
      },
      "confidence": 0.75,
      "notes": "劫营按对手留手2.4牌净差估计，破袭按己方弃牌与减上限/结束阶段代价折扣；需要后续对局校准。"
    },
    "re_sunshangxiang": {
      "vector": {
        "cards": 0.6,
        "heal": 0.3,
        "cost": 0.45,
        "quality": 0.2
      },
      "confidence": 0.75,
      "notes": "结姻在单挑须与敌方男性比较血量，收益分支不能全算己方；枭姬按失装备频率折算。"
    },
    "re_caozhang": {
      "vector": {
        "cards": 1,
        "quality": 0.2,
        "burst": 0.3
      },
      "confidence": 0.75,
      "notes": "将驰三个选项互斥：稳定选摸1；摸2禁杀或弃1增杀仅作为牌质/爆发补偿，不叠加三分支摸牌。"
    },
    "ol_yuanji": {
      "vector": {
        "cards": 1.2,
        "quality": 0.7
      },
      "confidence": 0.75,